title,id,subreddit,score,num_comments,url,created
Become a Data Engineer in 2025 - Based on 100 Jobs data!,1hv6ot8,dataengineering,264,47,https://www.reddit.com/r/dataengineering/comments/1hv6ot8/become_a_data_engineer_in_2025_based_on_100_jobs/,2025-01-06 18:58:38
hot take: most analytics projects fail bc they start w/ solutions not problems,1ht5swe,dataengineering,250,59,https://www.reddit.com/r/dataengineering/comments/1ht5swe/hot_take_most_analytics_projects_fail_bc_they/,2025-01-04 03:57:31
Your executives want dashboards but cant explain what they want?,1hsiyq3,dataengineering,241,58,https://www.reddit.com/r/dataengineering/comments/1hsiyq3/your_executives_want_dashboards_but_cant_explain/,2025-01-03 09:47:29
Databases in 2024: A Year in Review,1hrckhx,dataengineering,228,8,https://www.cs.cmu.edu/~pavlo/blog/2025/01/2024-databases-retrospective.html,2025-01-01 21:08:21
"The job market in Data Engineering is tough at the moment, applied for 40 jobs as a current Senior Data Engineer and had 3 get back and then ghost. Before last year I had loads lined up but decided to stay.",1hsnbca,dataengineering,176,77,https://www.reddit.com/r/dataengineering/comments/1hsnbca/the_job_market_in_data_engineering_is_tough_at/,2025-01-03 14:12:03
Databricks Certified Data Engineer Associate - I PASSED!!!,1hsnqzv,dataengineering,173,17,https://www.reddit.com/r/dataengineering/comments/1hsnqzv/databricks_certified_data_engineer_associate_i/,2025-01-03 14:33:04
Company couldn't care less about Single Source of Truth despite important reports running with two different numbers.,1hrlyx0,dataengineering,113,34,https://www.reddit.com/r/dataengineering/comments/1hrlyx0/company_couldnt_care_less_about_single_source_of/,2025-01-02 04:49:57
Cleared the Google Certified professional data engineer certification,1hqgah3,dataengineering,105,10,https://www.reddit.com/r/dataengineering/comments/1hqgah3/cleared_the_google_certified_professional_data/,2024-12-31 14:55:19
Dev: No Time for STAGING. It was URGENT!,1hsgnob,dataengineering,95,8,https://i.redd.it/7qqtjlli9qae1.jpeg,2025-01-03 07:02:51
"Is it just me who finds it mildly infuriating, when you say you have 4 years of experience in Scala, Spark and the recruiter goes ""Oh but do you have experience in pyspark?""",1hv4pd9,dataengineering,88,44,https://www.reddit.com/r/dataengineering/comments/1hv4pd9/is_it_just_me_who_finds_it_mildly_infuriating/,2025-01-06 17:38:00
Would you recommend data engineering as a career for 2025?,1hqid6m,dataengineering,88,47,https://www.reddit.com/r/dataengineering/comments/1hqid6m/would_you_recommend_data_engineering_as_a_career/,2024-12-31 16:34:13
Data Engineering Zoomcamp starts next week - learn DE for free!,1hvne3s,dataengineering,95,8,https://www.reddit.com/r/dataengineering/comments/1hvne3s/data_engineering_zoomcamp_starts_next_week_learn/,2025-01-07 08:59:37
I made it! Finally titled properly!,1ht8832,dataengineering,70,6,https://www.reddit.com/r/dataengineering/comments/1ht8832/i_made_it_finally_titled_properly/,2025-01-04 06:18:44
"Just Launched: dbt™ Data Modeling Challenge - Fantasy Football Edition ($3,000 Prize Pool)",1hs4uk0,dataengineering,52,9,https://www.reddit.com/r/dataengineering/comments/1hs4uk0/just_launched_dbt_data_modeling_challenge_fantasy/,2025-01-02 21:22:22
Building a LeetCode-like Platform for PySpark Prep,1hsk6g9,dataengineering,52,15,https://www.reddit.com/r/dataengineering/comments/1hsk6g9/building_a_leetcodelike_platform_for_pyspark_prep/,2025-01-03 11:11:08
Should SQL-Savvy Data Engineers Learn Pandas When DuckDB Supports SQL in Python?,1hrn7f3,dataengineering,51,35,https://www.reddit.com/r/dataengineering/comments/1hrn7f3/should_sqlsavvy_data_engineers_learn_pandas_when/,2025-01-02 06:05:43
Udacity vs DataCamp: Which Data Engineering Course Should I Choose?,1htz17n,dataengineering,49,36,https://www.reddit.com/r/dataengineering/comments/1htz17n/udacity_vs_datacamp_which_data_engineering_course/,2025-01-05 05:53:37
First time extracting data from an API,1htjbdp,dataengineering,42,26,https://www.reddit.com/r/dataengineering/comments/1htjbdp/first_time_extracting_data_from_an_api/,2025-01-04 17:23:50
Excessive denormalization in production DB's,1hru0zu,dataengineering,43,30,https://www.reddit.com/r/dataengineering/comments/1hru0zu/excessive_denormalization_in_production_dbs/,2025-01-02 13:46:22
Are all DE jobs meeting-heavy? ,1hv1ktd,dataengineering,40,35,https://www.reddit.com/r/dataengineering/comments/1hv1ktd/are_all_de_jobs_meetingheavy/,2025-01-06 15:28:38
